INITIALIZATION
CREATE TABLE UPDATE_TABLE_1(ID INT, T_NAME CHAR, COL1 INT, COL2 INT);
SUCCESS
CREATE INDEX INDEX_ID ON UPDATE_TABLE_1(ID);
SUCCESS
INSERT INTO UPDATE_TABLE_1 VALUES (1,'N1',1,1);
SUCCESS
INSERT INTO UPDATE_TABLE_1 VALUES (2,'N2',1,1);
SUCCESS
INSERT INTO UPDATE_TABLE_1 VALUES (3,'N3',2,1);
SUCCESS

1. UPDATE A ROW
UPDATE UPDATE_TABLE_1 SET T_NAME='N01' WHERE ID=1;
SUCCESS
SELECT * FROM UPDATE_TABLE_1;
1 | N01 | 1 | 1
2 | N2 | 1 | 1
3 | N3 | 2 | 1
ID | T_NAME | COL1 | COL2

2. UPDATE ROWS
UPDATE UPDATE_TABLE_1 SET COL2=0 WHERE COL1=1;
SUCCESS
SELECT * FROM UPDATE_TABLE_1;
1 | N01 | 1 | 0
2 | N2 | 1 | 0
3 | N3 | 2 | 1
ID | T_NAME | COL1 | COL2

3. UPDATE A INDEX COLUMN
UPDATE UPDATE_TABLE_1 SET ID=4 WHERE T_NAME='N3';
SUCCESS
SELECT * FROM UPDATE_TABLE_1;
1 | N01 | 1 | 0
2 | N2 | 1 | 0
4 | N3 | 2 | 1
ID | T_NAME | COL1 | COL2

4. UPDATE WITHOUT CONDITIONS
UPDATE UPDATE_TABLE_1 SET COL1=0;
SUCCESS
SELECT * FROM UPDATE_TABLE_1;
1 | N01 | 0 | 0
2 | N2 | 0 | 0
4 | N3 | 0 | 1
ID | T_NAME | COL1 | COL2

5. UPDATE WITH CONDITIONS
UPDATE UPDATE_TABLE_1 SET T_NAME='N02' WHERE COL1=0 AND COL2=0;
SUCCESS
SELECT * FROM UPDATE_TABLE_1;
1 | N02 | 0 | 0
2 | N02 | 0 | 0
4 | N3 | 0 | 1
ID | T_NAME | COL1 | COL2

6. UPDATE NON-EXISTENT TABLE
UPDATE UPDATE_TABLE_2 SET T_NAME='N01' WHERE ID=1;
FAILURE

7. UPDATE NON-EXISTENT COLUMN
UPDATE UPDATE_TABLE_1 SET T_NAME_FALSE='N01' WHERE ID=1;
FAILURE

8. UPDATE WITH INVALID CONDITION
UPDATE UPDATE_TABLE_1 SET T_NAME='N01' WHERE ID_FALSE=1;
FAILURE

9. UPDATE IN VAIN
UPDATE UPDATE_TABLE_1 SET T_NAME='N01' WHERE ID=100;
SUCCESS
SELECT * FROM UPDATE_TABLE_1;
1 | N02 | 0 | 0
2 | N02 | 0 | 0
4 | N3 | 0 | 1
ID | T_NAME | COL1 | COL2

10. UPDATE WITH INVALID VALUE
UPDATE UPDATE_TABLE_1 SET COL1='N01' WHERE ID=1;
SUCCESS
