1. MULTI INDEX OF EMPTY TABLE
CREATE TABLE MULTI_INDEX(ID INT, COL1 INT, COL2 FLOAT, COL3 CHAR, COL4 DATE, COL5 INT, COL6 INT);
SUCCESS
CREATE INDEX I_1_12 ON MULTI_INDEX(COL1,COL2);
SUCCESS
CREATE INDEX I_1_345 ON MULTI_INDEX(COL3, COL4, COL5);
SUCCESS
CREATE INDEX I_1_56 ON MULTI_INDEX(COL5, COL6);
SUCCESS
CREATE INDEX I_1_456 ON MULTI_INDEX(COL4, COL5, COL6);
SUCCESS
SELECT * FROM MULTI_INDEX;
ID | COL1 | COL2 | COL3 | COL4 | COL5 | COL6

2. MULTI INDEX OF NON-EMPTY TABLE
CREATE TABLE MULTI_INDEX2(ID INT, COL1 INT, COL2 FLOAT, COL3 CHAR, COL4 DATE, COL5 INT, COL6 INT);
SUCCESS
INSERT INTO MULTI_INDEX2 VALUES (1, 1, 11.2, 'A', '2021-01-02', 1, 1);
SUCCESS
INSERT INTO MULTI_INDEX2 VALUES (2, 1, 16.2, 'X', '2021-01-02', 1, 61);
SUCCESS
INSERT INTO MULTI_INDEX2 VALUES (3, 1, 11.6, 'H', '2023-01-02', 10, 17);
SUCCESS

CREATE INDEX I_2_12 ON MULTI_INDEX2(COL1,COL2);
SUCCESS
CREATE INDEX I_2_345 ON MULTI_INDEX2(COL3, COL4, COL5);
SUCCESS
CREATE INDEX I_2_56 ON MULTI_INDEX2(COL5, COL6);
SUCCESS
CREATE INDEX I_2_456 ON MULTI_INDEX2(COL4, COL5, COL6);
SUCCESS
SELECT * FROM MULTI_INDEX2;
1 | 1 | 11.2 | A | 2021-01-02 | 1 | 1
2 | 1 | 16.2 | X | 2021-01-02 | 1 | 61
3 | 1 | 11.6 | H | 2023-01-02 | 10 | 17
ID | COL1 | COL2 | COL3 | COL4 | COL5 | COL6

3. INFLUENCE OF INSERTING
CREATE TABLE MULTI_INDEX3(ID INT, COL1 INT, COL2 FLOAT, COL3 CHAR, COL4 DATE, COL5 INT, COL6 INT);
SUCCESS
CREATE INDEX I_3_I1 ON MULTI_INDEX3(ID,COL1);
SUCCESS

INSERT INTO MULTI_INDEX3 VALUES (1, 1, 11.2, 'A', '2021-01-02', 1, 1);
SUCCESS
INSERT INTO MULTI_INDEX3 VALUES (1, 1, 11.2, 'A', '2021-01-02', 1, 1);
SUCCESS
SELECT * FROM MULTI_INDEX3;
1 | 1 | 11.2 | A | 2021-01-02 | 1 | 1
1 | 1 | 11.2 | A | 2021-01-02 | 1 | 1
ID | COL1 | COL2 | COL3 | COL4 | COL5 | COL6
CREATE INDEX I_3_14 ON MULTI_INDEX3(COL1,COL4);
SUCCESS
INSERT INTO MULTI_INDEX3 VALUES (2, 1, 16.2, 'X', '2021-01-02', 1, 61);
SUCCESS
INSERT INTO MULTI_INDEX3 VALUES (3, 1, 11.6, 'H', '2023-01-02', 10, 17);
SUCCESS
INSERT INTO MULTI_INDEX3 VALUES (4, 2, 12.2, 'E', '2022-01-04', 13, 10);
SUCCESS
INSERT INTO MULTI_INDEX3 VALUES (5, 3, 14.2, 'D', '2020-04-02', 12, 2);
SUCCESS
SELECT * FROM MULTI_INDEX3;
1 | 1 | 11.2 | A | 2021-01-02 | 1 | 1
1 | 1 | 11.2 | A | 2021-01-02 | 1 | 1
2 | 1 | 16.2 | X | 2021-01-02 | 1 | 61
3 | 1 | 11.6 | H | 2023-01-02 | 10 | 17
4 | 2 | 12.2 | E | 2022-01-04 | 13 | 10
5 | 3 | 14.2 | D | 2020-04-02 | 12 | 2
ID | COL1 | COL2 | COL3 | COL4 | COL5 | COL6

4. QUERY WITH INDEXS
SELECT * FROM MULTI_INDEX3 WHERE ID = 1;
1 | 1 | 11.2 | A | 2021-01-02 | 1 | 1
1 | 1 | 11.2 | A | 2021-01-02 | 1 | 1
ID | COL1 | COL2 | COL3 | COL4 | COL5 | COL6
SELECT * FROM MULTI_INDEX3 WHERE COL1 > 1 AND COL4 = '2021-01-02';
ID | COL1 | COL2 | COL3 | COL4 | COL5 | COL6
SELECT * FROM MULTI_INDEX3 WHERE COL1 <> 1 AND COL4 >= '2021-01-02';
4 | 2 | 12.2 | E | 2022-01-04 | 13 | 10
ID | COL1 | COL2 | COL3 | COL4 | COL5 | COL6
SELECT * FROM MULTI_INDEX3 WHERE COL2 < 15.0 AND COL4 <> '2021-01-02';
3 | 1 | 11.6 | H | 2023-01-02 | 10 | 17
4 | 2 | 12.2 | E | 2022-01-04 | 13 | 10
5 | 3 | 14.2 | D | 2020-04-02 | 12 | 2
ID | COL1 | COL2 | COL3 | COL4 | COL5 | COL6

5. INFLUENCE OF DELETING
DELETE FROM MULTI_INDEX3 WHERE ID = 1;
SUCCESS
DELETE FROM MULTI_INDEX3 WHERE ID = 61;
SUCCESS
SELECT * FROM MULTI_INDEX3;
2 | 1 | 16.2 | X | 2021-01-02 | 1 | 61
3 | 1 | 11.6 | H | 2023-01-02 | 10 | 17
4 | 2 | 12.2 | E | 2022-01-04 | 13 | 10
5 | 3 | 14.2 | D | 2020-04-02 | 12 | 2
ID | COL1 | COL2 | COL3 | COL4 | COL5 | COL6

DELETE FROM MULTI_INDEX3 WHERE COL3 = 'X';
SUCCESS
SELECT * FROM MULTI_INDEX3;
3 | 1 | 11.6 | H | 2023-01-02 | 10 | 17
4 | 2 | 12.2 | E | 2022-01-04 | 13 | 10
5 | 3 | 14.2 | D | 2020-04-02 | 12 | 2
ID | COL1 | COL2 | COL3 | COL4 | COL5 | COL6

DELETE FROM MULTI_INDEX3 WHERE ID = 4 AND COL1 = 1;
SUCCESS
DELETE FROM MULTI_INDEX3 WHERE ID = 90 AND COL1 = 13;
SUCCESS
DELETE FROM MULTI_INDEX3 WHERE ID = 90 AND COL1 = 1;
SUCCESS
DELETE FROM MULTI_INDEX3 WHERE ID = 4 AND COL1 = 13;
SUCCESS
DELETE FROM MULTI_INDEX3 WHERE ID = 3 AND COL1 = 1;
SUCCESS
DELETE FROM MULTI_INDEX3 WHERE ID = 3 AND COL1 = 1;
SUCCESS
SELECT * FROM MULTI_INDEX3;
4 | 2 | 12.2 | E | 2022-01-04 | 13 | 10
5 | 3 | 14.2 | D | 2020-04-02 | 12 | 2
ID | COL1 | COL2 | COL3 | COL4 | COL5 | COL6

INSERT INTO MULTI_INDEX3 VALUES (1, 1, 11.2, 'A', '2021-01-02', 1, 1);
SUCCESS
INSERT INTO MULTI_INDEX3 VALUES (2, 1, 11.2, 'X', '2021-01-02', 1, 61);
SUCCESS
INSERT INTO MULTI_INDEX3 VALUES (3, 1, 11.2, 'H', '2023-01-02', 10, 17);
SUCCESS
SELECT * FROM MULTI_INDEX3;
1 | 1 | 11.2 | A | 2021-01-02 | 1 | 1
2 | 1 | 11.2 | X | 2021-01-02 | 1 | 61
3 | 1 | 11.2 | H | 2023-01-02 | 10 | 17
4 | 2 | 12.2 | E | 2022-01-04 | 13 | 10
5 | 3 | 14.2 | D | 2020-04-02 | 12 | 2
ID | COL1 | COL2 | COL3 | COL4 | COL5 | COL6

6. INFLUENCE OF UPDATING
UPDATE MULTI_INDEX3 SET COL6=49 WHERE ID=2;
SUCCESS
UPDATE MULTI_INDEX3 SET COL4='1999-02-01' WHERE ID=2;
SUCCESS
UPDATE MULTI_INDEX3 SET COL1=2 WHERE ID=2;
SUCCESS
UPDATE MULTI_INDEX3 SET COL1=5 WHERE COL6=49;
SUCCESS
SELECT * FROM MULTI_INDEX3;
1 | 1 | 11.2 | A | 2021-01-02 | 1 | 1
2 | 5 | 11.2 | X | 1999-02-01 | 1 | 49
3 | 1 | 11.2 | H | 2023-01-02 | 10 | 17
4 | 2 | 12.2 | E | 2022-01-04 | 13 | 10
5 | 3 | 14.2 | D | 2020-04-02 | 12 | 2
ID | COL1 | COL2 | COL3 | COL4 | COL5 | COL6

7. INFLUENCE OF DROPPING TABLE
DROP TABLE MULTI_INDEX;
SUCCESS

8. ERROR
CREATE TABLE MULTI_INDEX4(ID INT, COL1 INT, COL2 FLOAT, COL3 CHAR, COL4 DATE, COL5 INT, COL6 INT);
SUCCESS

CREATE INDEX I_4_I7 ON MULTI_INDEX4(ID,COL7);
FAILURE
CREATE INDEX I_4_78 ON MULTI_INDEX4(COL7,COL8);
FAILURE
CREATE INDEX I_4_I78 ON MULTI_INDEX4(ID,COL7,COL8);
FAILURE
