1. DROP EMPTY TABLE
CREATE TABLE DROP_TABLE_1(ID INT, T_NAME CHAR);
SUCCESS
DROP TABLE DROP_TABLE_1;
SUCCESS

2. DROP NON-EMPTY TABLE
CREATE TABLE DROP_TABLE_2(ID INT, T_NAME CHAR);
SUCCESS
INSERT INTO DROP_TABLE_2 VALUES (1,'OB');
SUCCESS
DROP TABLE DROP_TABLE_2;
SUCCESS

3. CHECK THE ACCURACY OF DROPPING TABLE
CREATE TABLE DROP_TABLE_3(ID INT, T_NAME CHAR);
SUCCESS
INSERT INTO DROP_TABLE_3 VALUES (1,'OB');
SUCCESS
SELECT * FROM DROP_TABLE_3;
1 | OB
ID | T_NAME
DROP TABLE DROP_TABLE_3;
SUCCESS
INSERT INTO DROP_TABLE_3 VALUES (1,'OB');
FAILURE
SELECT * FROM DROP_TABLE_3;
FAILURE
DELETE FROM DROP_TABLE_3 WHERE ID = 3;
FAILURE
CREATE TABLE DROP_TABLE_3(ID INT, T_NAME CHAR);
SUCCESS
SELECT * FROM DROP_TABLE_3;
ID | T_NAME

4. DROP NON-EXISTENT TABLE
CREATE TABLE DROP_TABLE_4(ID INT, T_NAME CHAR);
SUCCESS
DROP TABLE DROP_TABLE_4;
SUCCESS
DROP TABLE DROP_TABLE_4;
FAILURE
DROP TABLE DROP_TABLE_4_1;
FAILURE

5. CREATE A TABLE WHICH HAS DROPPED
CREATE TABLE DROP_TABLE_5(ID INT, T_NAME CHAR);
SUCCESS
DROP TABLE DROP_TABLE_5;
SUCCESS
CREATE TABLE DROP_TABLE_5(ID INT, T_NAME CHAR);
SUCCESS
SELECT * FROM DROP_TABLE_5;
ID | T_NAME

6. DROP A TABLE WITH INDEX
CREATE TABLE DROP_TABLE_6(ID INT, T_NAME CHAR);
SUCCESS
CREATE INDEX INDEX_ID ON DROP_TABLE_6(ID);
SUCCESS
INSERT INTO DROP_TABLE_6 VALUES (1,'OB');
SUCCESS
SELECT * FROM DROP_TABLE_6;
1 | OB
ID | T_NAME
DROP TABLE DROP_TABLE_6;
SUCCESS
SELECT * FROM DROP_TABLE_6;
FAILURE
